,Accepted,Affiliations,Authors,Category,Countries,Issue,Keywords,Ncitations,Published,Received,Title,Volume
0,2015-08-26,,Evert Slob,Editor's Corner,,5,-,0,2015-08-26,2015-08-26,This issue of Geophysics,80
1,2015-05-08,University of Alberta,Nasser Kazemi; Mauricio D. Sacchi,Geophysics Letters,Canada,5,algorithm; imaging; least squares; migration; wave equation,5,2015-07-06,2015-01-30,Block row recursive least-squares migration,80
2,2015-05-01,The University of Texas at Austin,Junzhe Sun; Tieyuan Zhu; Sergey Fomel,Geophysics Letters,USA,5,attenuation; modeling; migration; acoustic; Reverse time migration,28,2015-07-20,2015-02-05,Viscoacoustic modeling and imaging using low-rank approximation,80
3,2015-05-04,University of Western Ontario; University of Western Australia; University of Western Ontario; JOGMEC; INPEX Corporation,Rie Kamei; Takayuki Miyoshi; R. Gerhard Pratt; Mamoru Takanashi; Shogo Masaya,Case Histories,Canada; Australia; Canada; Japan; Japan,5,acquisition; wave equation; case history; velocity analysis; inversion,7,2015-07-16,2014-11-17,Application of waveform tomography to a crooked-line 2D land seismic data set,80
4,2015-04-16,Uppsala University; Geological Survey of Sweden,Jochen Kamm; Ildikó Antal Lundin; Mehrdad Bastani; Martiya Sadeghi; Laust B. Pedersen,Case Histories,Sweden; Sweden,5,inversion; gravity; magnetics; rock physics; algorithm,11,2015-07-16,2014-03-14,"Joint inversion of gravity, magnetic, and petrophysical data — A case study from a gabbro intrusion in Boden, Sweden",80
5,2015-05-01,SINTEF Petroleum Research; German Research Centre for Geosciences; British Geological Survey,Peter Bergmann; Andrew Chadwick,Case Histories,Norway; Germany; UK,5,4D; time-lapse; interpretation,3,2015-07-30,2014-12-15,"Volumetric bounds on subsurface fluid substitution using 4D seismic time shifts with an application at Sleipner, North Sea",80
6,2015-05-23,The University of Texas at Austin,Yanadet Sripanich; Sergey Fomel,Anisotropy,USA,5,anisotropy; velocity analysis; wave propagation; traveltime; multiparameter,20,2015-08-21,2014-11-14,On anelliptic approximations for qP velocities in transversely isotropic and orthorhombic media,80
7,2015-04-20,Harbin Institute of Technology,Xiaobo Zheng; Hengshan Hu; Wei Guan; Jun Wang,Borehole Geophysics and Rock Properties,China,5,acoustic; Asia; logging,4,2015-06-22,2014-10-29,Simulation of the borehole quasistatic electric field excited by the acoustic wave during logging while drilling due to electrokinetic effect,80
8,2015-05-01,Norwegian University of Science and Technology,Martin Landrø,Borehole Geophysics and Rock Properties,Norway,5,rock physics; 2D; 3D; anisotropy; fractures,1,2015-07-06,2014-10-08,Aspect ratio histograms of 3D ellipsoids and 2D ellipses — Analytical relations and numerical examples,80
9,2015-04-20,Politecnico di Torino; Università degli Studi di Torino,Guido Musso; Renato Maria Cosentini; Sebastiano Foti; Cesare Comina; Gaia Capasso,Borehole Geophysics and Rock Properties,Italy; Italy; Italy,5,sample damage; fabric/structure of rock; stress dependent wave velocities; geomechanical characterization,1,2015-07-16,2014-07-31,Assessment of the structural representativeness of sample data sets for the mechanical characterization of deep formations,80
10,2015-05-01,"The University of Texas at Austin; The University of Texas at Austin; Baker Hughes, Inc.",Shan Huang; Paweł J. Matuszyk; Carlos Torres-Verdín,Borehole Geophysics and Rock Properties,USA; USA,5,acoustic; logging; log analysis; modeling,4,2015-07-17,2014-12-12,Spatial sensitivity functions for rapid numerical simulation of borehole sonic measurements in vertical wells,80
11,2015-04-20,Istituto Nazionale di Oceanografia e di Geofisica Sperimentale; Norwegian University of Science and Technology; Tullow Oil,José M. Carcione; Per Avseth,Borehole Geophysics and Rock Properties,Italy; Norway; Norway,5,source rock; kerogen; oil; gas; Backus; Gassmann; smectite/illite; AVO; rock-physics templates,11,2015-07-17,2014-11-04,Rock-physics templates for clay-rich source rocks,80
12,2015-05-01,The University of Texas at Austin,Oyinkansola Ajayi; Carlos Torres-Verdín; William E. Preeg,Borehole Geophysics and Rock Properties,USA; USA,5,logging; log analysis; interpretation; lithology; inversion,5,2015-07-20,2014-12-12,Fast numerical simulation of logging-while-drilling gamma-ray spectroscopy measurements,80
13,2015-04-20,"Colorado School of Mines; Université de Savoie; Université Pierre et Marie Curie; UMI 209 UMMISCO; UMR 7619 “METIS,” UPMC-CNRS; Colorado School of Mines",André Revil; Nicolas Florsch; Deqiang Mao,Borehole Geophysics and Rock Properties,USA; France; France; France; USA,5,electromagnetics; induced polarization (IP); resistivity; rock physics,16,2015-08-03,2014-12-07,Induced polarization response of porous media with metallic particles — Part 1: A theory for disseminated semiconductors,80
14,2015-06-19,"Colorado School of Mines; Université de Savoie; Oklahoma State University; Assiut University; Oklahoma State University; Colorado School of Mines; Université Pierre et Marie Curie; UMI 209 UMMISCO; UMR 7619 “METIS,” UPMC-CNRS",André Revil; Gamal Z. Abdel Aal; Estella A. Atekwana; Deqiang Mao; Nicolas Florsch,Borehole Geophysics and Rock Properties,USA; France; USA; Egypt; USA; USA; France; France,5,electromagnetics; induced polarization (IP); resistivity; rock physics,13,2015-08-12,2014-12-07,Induced polarization response of porous media with metallic particles — Part 2: Comparison with a broad database of experimental data,80
15,2015-05-01,Schlumberger Doll Research,Vasileios-Marios Gkortsas; Lalitha Venkataramanan; T. S. Ramakrishnan; Denise Freed,Electrical and Electromagnetic Methods,USA,5,electromagnetics; borehole geophysics; inversion,0,2015-07-17,2015-01-19,Indication of wettability from dielectric measurements on partially saturated rocks using effective medium models,80
16,2015-05-23,Moscow State University,Nikita Zorin,Electrical and Electromagnetic Methods,Russia,5,induced polarization (IP); electromagnetics,0,2015-07-24,2014-04-07,Spectral induced polarization of low and moderately polarizable buried objects,80
17,2015-05-01,University of Toronto; University of Leeds; School of Earth and Environment; University of Toronto,Lisa A. N. Roach; R. Nigel Edwards,Engineering and Environmental Geophysics,Canada; UK; Canada,5,hydrates; seafloor; sediment; oceanography; shear modulus,0,2015-06-26,2014-11-18,"A temporal trend in compliance measurements near a gas hydrate accumulation, Northern Cascadia",80
18,2015-06-11,XRI Geophysics; Kansas Geological Survey; United States Army Engineer Research &amp; Development Center; 4QTRS Holdings,Steven D. Sloan; Shelby L. Peterie; Richard D. Miller; Julian Ivanov; J. Tyler Schwenk; Jason R. McKenna,Engineering and Environmental Geophysics,USA; USA; USA; USA,5,near surface; diffraction; surface wave; environmental,18,2015-08-03,2014-11-10,Detecting clandestine tunnels using near-surface seismic techniques,80
19,2015-06-09,University of Trieste,Matteo Dossi; Emanuele Forte; Michele Pipan,Ground-penetrating Radar,Italy,5,ground-penetrating radar (GPR); attributes; interpretation; reflection; wavelet,3,2015-08-03,2015-02-11,Automated reflection picking and polarity assessment through attribute analysis: Theory and application to synthetic and real ground-penetrating radar data,80
20,2015-05-01,Colorado School of Mines,Andrew Muñoz; Dave Hale,Interpretation Methods,USA,5,wells; interpretation; borehole geophysics; log analysis; signal processing,8,2015-07-24,2014-09-24,Automatic simultaneous multiple well ties,80
21,2015-05-08,Observatório Nacional; CGG Multi-Physics; Observatório Nacional,Marlon C. Hidalgo-Gato; Valéria C. F. Barbosa,Magnetic Exploration Methods,Brazil; Brazil; Brazil,5,magnetics; filtering; signal processing,7,2015-07-24,2015-01-14,Edge detection of potential-field sources using scale-space monogenic signal: Fundamental principles,80
22,2015-06-22,PSL Research University,Lucas Pimienta; Jérôme Fortin; Yves Guéguen,Poroelasticity,France,5,noise; attenuation; signal processing; sparse; wavelet,17,2015-08-12,2014-11-14,Experimental study of Young’s modulus dispersion and attenuation in fully saturated sandstones,80
23,2015-05-12,University of Western Australia; University of Western Australia,Mohammad Emami Niri; David E. Lumley,Reservoir Geophysics,Australia; Australia,5,reservoir characterization; modeling; optimization; 3D; seismic attributes and inversion,4,2015-07-29,2015-01-04,Simultaneous optimization of multiple objective functions for reservoir modeling,80
24,2015-06-28,Colorado School of Mines; Colorado School of Mines; Université de Savoie,J. Zhang; A. Revil,Reservoir Geophysics,USA; USA; France,5,apparent resistivity; imaging; density; electrical/resistivity; gravity,9,2015-08-12,2015-03-05,2D joint inversion of geophysical data using petrophysical clustering and facies deformation,80
25,2015-06-09,Stanford University; Stanford University; Schlumberger,Céline Scheidt; Cheolkyun Jeong; Tapan Mukerji; Jef Caers,Reservoir Geophysics,USA; USA; USA,5,reservoir characterization; modeling; amplitude; Africa,5,2015-08-17,2015-02-05,Probabilistic falsification of prior geologic uncertainty with seismic amplitude data: Application to a turbidite reservoir case,80
26,2015-05-01,China University of Petroleum; University of Alberta,Guofa Li; Mauricio D. Sacchi; Yajing Wang; Hao Zheng,Seismic Amplitude Interpretation,China; Canada; China,5,seismic attributes; interpretation; reservoir characterization; bed thickness; sequence stratigraphy,4,2015-07-24,2014-12-23,Characterization of interbedded thin beds using zero-crossing-time amplitude stratal slices,80
27,2015-05-04,University of Tehran,Ali Gholami,Seismic Inversion,Iran,5,impedance; inversion; deconvolution,14,2015-07-16,2015-01-03,Nonlinear multichannel impedance inversion by total-variation regularization,80
28,2015-05-08,University of Calgary; China University of Petroleum (Huadong),Wenyong Pan; Kristopher A. Innanen; Gary F. Margrave; Danping Cao,Seismic Inversion,Canada; China,5,inversion; least squares; reverse time migration; tomography; optimization,8,2015-07-23,2014-05-12,Efficient pseudo-Gauss-Newton full-waveform inversion in the τ-p domain,80
29,2015-06-11,China University of Geosciences; Chinese Academy of Sciences,Jun Lu; Zhen Yang; Yun Wang; Ying Shi,Seismic Inversion,China; China,5,amplitude variation with offset (AVO); inversion; compressional wave (P-wave); converted wave; least squares,8,2015-07-29,2014-10-15,Joint PP and PS AVA seismic inversion using exact Zoeppritz equations,80
30,2015-05-22,King Abdullah University of Science and Technology,Yunseok Choi; Tariq Alkhalifah,Seismic Inversion,Saudi Arabia,5,inversion; phase; frequency-domain,10,2015-07-28,2014-10-20,Unwrapped phase inversion with an exponential damping,80
31,2015-05-26,Tsinghua University,Zhilong Fang; Dinghui Yang,Seismic Inversion,China,5,algorithm; attenuation; dispersion; inversion; rock physics,1,2015-08-17,2014-11-13,"Inversion of reservoir porosity, saturation, and permeability based on a robust hybrid genetic algorithm",80
32,2015-05-26,Princeton University; Université de Nice,Yanhua O. Yuan; Frederik J. Simons; Ebru Bozdağ,Seismic Inversion,USA; France,5,near surface; surface wave; tomography; wavelet; dispersion,19,2015-08-17,2014-10-03,Multiscale adjoint waveform tomography for surface and body waves,80
33,2015-04-21,Colorado School of Mines; Colorado School of Mines; Seismic Science LLC; Delft University of Technology,Satyan Singh; Roel Snieder; Jyoti Behura; Joost van der Neut; Kees Wapenaar; Evert Slob,Seismic Migration,USA; USA; USA; The Netherlands,5,multiples; scattering; imaging; reflectivity; reciprocity,30,2015-07-17,2014-10-16,"Marchenko imaging: Imaging with primaries, internal multiples, and free-surface multiples",80
34,2015-05-23,Chinese Academy of Sciences; Chinese Academy of Sciences; University of Houston; University of California at Santa Cruz; University of Houston; BGP Research &amp; Development Center,Yike Liu; Hao Hu; Xiao-Bi Xie; Yingcai Zheng; Peng Li,Seismic Migration,China; China; USA; USA; USA; China,5,imaging; migration; multiples; subsalt; RTM,3,2015-07-31,2014-09-11,Reverse time migration of internal multiples for subsalt imaging,80
35,2015-05-23,University of Edinburgh,Carlos Alberto da Costa Filho; Matteo Ravasi; Andrew Curtis,Seismic Migration,UK,5,seismic migration; seismic interferometry,16,2015-08-03,2014-11-03,Elastic P- and S-wave autofocus imaging with primaries and internal multiples,80
36,2015-05-13,Kalkulo AS; University of Oslo; Kalkulo AS; Bank of America Merrill Lynch,Marcus Noack; Tor Gillberg,Seismic Modeling and Wave Propagation,Norway; Norway; UK,5,amplitude; finite difference; traveltime; wave propagation,1,2015-07-24,2014-12-01,Fast computation of eikonal and transport equations on graphics processing units computer architectures,80
37,2015-06-14,Université Grenoble Alpes; Center for Excellence in Parallel Programming; Universidad Nacional Autónoma de México,Longfei Gao; Romain Brossier; Benjamin Pajot; Josué Tago; Jean Virieux,Seismic Modeling and Wave Propagation,France; France; Mexico,5,Wave equation; free surface; immersed-boundary methods; extrapolation; staggered grid; instability,6,2015-08-26,2014-12-24,An immersed free-surface boundary treatment for seismic wave simulation,80
38,2015-06-15,University of Houston; Halliburton,Yue Du; Mark E. Willis; Robert R. Stewart,Seismic Velocity/Statics,USA; USA,5,vertical seismic profile (VSP); velocity analysis; migration,0,2015-08-17,2014-05-20,Vertical seismic profile migration velocity analysis via residual moveout in receiver domain common image gathers,80
39,2015-04-23,University of British Columbia; University of British Columbia; University of Wisconsin-Madison; IBM T.J. Watson Research; Mitsubishi Electric Research Laboratories; University of California,Rajiv Kumar; Curt Da Silva; Okan Akalin; Aleksandr Y. Aravkin; Hassan Mansour; Benjamin Recht; Felix J. Herrmann,Signal Processing,Canada; Canada; USA; USA; USA; USA,5,2D; 3D; algorithm; interpolation; signal processing,16,2015-08-05,2014-08-08,Efficient matrix completion for seismic data reconstruction,80
40,2015-06-28,Chinese Academy of Sciences,Shoudong Huo,Signal Processing,China,5,spectral analysis; seismic attributes,1,2015-07-31,2015-04-13,Adaptive local frequency,80
41,2015-05-08,Harbin Institute of Technology; Shanghai Jiao Tong University; University of Alberta,Siwei Yu; Jianwei Ma; Xiaoqun Zhang; Mauricio D. Sacchi,Signal Processing,China; China; Canada,5,interpolation; signal processing; wavelet,23,2015-07-31,2014-08-20,Interpolation and denoising of high-dimensional seismic data by learning a tight frame,80
42,2015-05-01,"ETH Zurich, Institute of Geophysics; Schlumberger Gould Research",Moritz B. Mueller; David F. Halliday; Dirk-Jan van Manen; Johan O. A. Robertsson,Signal Processing,Switzerland; UK,5,acquisition; air gun; processing; Radon transform; sources,11,2015-08-12,2015-01-15,The benefit of encoded source sequences for simultaneous source separation,80
