,Accepted,Affiliations,Authors,Category,Countries,Issue,Keywords,Ncitations,Published,Received,Title,Volume
0,2015-07-08,,,Editor's Corner,,4,-,0,2015-07-08,2015-07-08,This issue of Geophysics,80
1,2015-03-29,The University of Texas at Austin; China University of Petroleum; Institute of SINOPEC Shanghai Offshore Oil &amp; Gas Company; China University of Petroleum,Yangkang Chen; Tingting Liu; Xiaohong Chen,Geophysics Letters,USA; China; China; China,4,resolution,15,2015-06-10,2014-12-30,Velocity analysis using similarity-weighted semblance,80
2,2015-02-23,Massachusetts Institute of Technology; EXPEC Advanced Research Center; Massachusetts Institute of Technology,Abdulaziz M. Almuhaidib; M. Nafi Toksöz,Geophysics Letters,USA; Saudi Arabia; USA,4,converted wave; near surface; RTM; imaging; scattering,3,2015-06-10,2014-09-09,Imaging of near-surface heterogeneities by scattered elastic waves,80
3,2015-04-20,Universität Potsdam,Jens Tronicke; Niklas Allroggen,Geophysics Letters,Germany,4,ground-penetrating radar (GPR); near surface; sediment; hydrology,0,2015-06-10,2015-03-20,Toward automated delineation of ground-penetrating radar facies in clastic sediments: An example from stratified glaciofluvial deposits,80
4,2015-03-03,Università degli studi di Trieste,Tommaso Pivetta; Carla Braitenberg,Case Histories,Italy,4,gravity; environmental; modeling; near surface,3,2015-06-05,2014-12-19,Laser-scan and gravity joint investigation for subsurface cavity exploration — The Grotta Gigante benchmark,80
5,2015-03-08,Cooperative Research Centre for Greenhouse Gas Technologies (CO2CRC); Curtin University; University of Lausanne; CO2CRC; Curtin University; CO2CRC; Curtin University; CO2CRC; CSIRO Energy; CO2CRC; CSIRO Energy Flagship; CO2CRC; Saudi Aramco,Eva Caspari; Roman Pevzner; Boris Gurevich; Tess Dance; Jonathan Ennis-King; Yildiray Cinar; Maxim Lebedev,Case Histories,Australia; Switzerland; Australia; Australia; Australia; Australia; Australia; Australia; Saudi Arabia,4,4D; case history; rock physics; monitoring,8,2015-05-29,2014-09-28,Feasibility of CO2 plume detection using 4D seismic: CO2CRC Otway Project case study — Part 1: Rock-physics modeling,80
6,2014-12-08,CO2CRC; Curtin University; Cooperative Research Centre for Greenhouse Gas Technologies (CO2CRC); University of Lausanne; CO2CRC; Curtin University; CSIRO; CO2CRC; CSIRO Energy; CO2CRC; Saudi Aramco,Roman Pevzner; Eva Caspari; Boris Gurevich; Tess Dance; Yildiray Cinar,Case Histories,Australia; Australia; Australia; Australia; Switzerland; Australia; Australia; Australia; Australia; Australia; Australia; Saudi Arabia,4,4D; case history; monitoring; modeling; noise,8,2015-06-05,2014-09-28,Feasibility of CO2 plume detection using 4D seismic: CO2CRC Otway Project case study — Part 2: Detectability analysis,80
7,2015-03-23,Stanford University; Chulalongkorn University; Stanford University,Adam M. Allan; Waruntorn Kanitpanyacharoen; Tiziana Vanorio,Anisotropy,USA; Thailand; USA,4,rock physics; anisotropy; time-lapse; shale gas; reservoir characterization,12,2015-05-29,2014-04-24,A multiscale methodology for the analysis of velocity anisotropy in organic-rich shale,80
8,2015-02-20,CSIRO Energy Flagship,Tongcheng Han; Michael Ben Clennell; Matthew Josh; Marina Pervukhina,Borehole Geophysics and Rock Properties,Australia,4,electric conductivity; aspect ratio; cementation coefficient; sedimentary rocks,4,2015-05-05,2014-10-27,Determination of effective grain geometry for electrical modeling of sedimentary rocks,80
9,2015-02-20,China University of Petroleum; Massachusetts Institute of Technology; China University of Petroleum; The Petroleum Institute; Massachusetts Institute of Technology,Hua Wang; Guo Tao; Michael C. Fehler,Borehole Geophysics and Rock Properties,China; USA; China; United Arab Emirates; USA,4,acoustic; logging; modeling; wave propagation; downhole receivers,11,2015-05-22,2014-09-09,Investigation of the high-frequency wavefield of an off-center monopole acoustic logging-while-drilling tool,80
10,2015-03-09,University of Wyoming; Legends Exploration,Dario Grana; Mark Bronston,Borehole Geophysics and Rock Properties,USA; USA,4,amplitude variation with offset (AVO); seismic attributes; statistics; rock physics,1,2015-05-26,2014-11-06,Probabilistic formulation of AVO modeling and AVO-attribute-based facies classification using well logs,80
11,2015-03-08,Universidade de Évora; University of Aveiro; Universidade de Évora; Universidade de Évora; Universidade de Évora; University of Aveiro,Pedro Prezas; Hugo Gonçalves Silva; Ana Vinagre; Manuel Pedro F. Graça; Patrícia Moita; Mourad Bezzeghoud,Borehole Geophysics and Rock Properties,Portugal; Portugal; Portugal; Portugal; Portugal; Portugal,4,rock physics; borehole geophysics; electromagnetics; impedance; porosity,0,2015-05-26,2014-10-04,Adsorbed water clusters in garnet cracks detected by impedance and Raman spectroscopies at the supercooled water phase transition,80
12,2015-03-23,Colorado School of Mines; Colorado School of Mines; Université Savoie Mont Blanc; Colorado School of Mines; University of Texas at Austin,W. F. Woodruff; A. Revil; M. Prasad; C. Torres-Verdín,Borehole Geophysics and Rock Properties,USA; USA; France; USA; USA,4,anisotropy; shale gas; rock physics; resistivity; induced polarization (IP),7,2015-05-26,2014-11-15,Measurements of elastic and electrical properties of an unconventional organic shale under differential loading,80
13,2015-03-23,Texas A&amp;M University; Geophysics Group; The Chinese University of Hong Kong (CUHK); Texas A&amp;M University; Texas A&amp;M University; Texas A&amp;M University; King Abdullah University of Science and Technology,Kai Gao; Eric T. Chung; Richard L. Gibson Jr.; Shubin Fu; Yalchin Efendiev,Borehole Geophysics and Rock Properties,USA; USA; Hong Kong; USA; USA; USA; Saudi Arabia,4,rock physics; anisotropy; wave propagation,7,2015-06-05,2014-08-07,"A numerical homogenization method for heterogeneous, anisotropic elastic media based on multiscale theory",80
14,2015-03-29,Research Institute of Innovative Technology for the Earth (RITE),Yi Zhang; Osamu Nishizawa; Tamotsu Kiyama; Ziqiu Xue,Borehole Geophysics and Rock Properties,Japan,4,rock physics; attenuation; bulk modulus; compressional wave (P-wave); wave propagation,10,2015-06-10,2014-06-17,Saturation-path dependency of P-wave velocity and attenuation in sandstone saturated with CO2 and brine revealed by simultaneous measurements of waveforms and X-ray computed tomography images,80
15,2015-01-09,Tsinghua University; Tsinghua University; Lawrence Berkeley National Laboratory,Haohuan Fu; Yingqiao Wang; Evan Schankee Um; Jiarui Fang; Tengpeng Wei; Xiaomeng Huang; Guangwen Yang,Electrical and Electromagnetic Methods,China; China; USA,4,electromagnetics; finite element,6,2015-05-26,2014-02-08,A parallel finite-element time-domain method for transient electromagnetic simulation,80
16,2015-04-10,Colorado School of Mines,Andrei Swidinsky; Misac Nabighian,Electrical and Electromagnetic Methods,USA,4,Electromagnetics; marine; borehole,8,2015-06-17,2015-01-01,On smoke rings produced by a loop buried in a conductive half-space,80
17,2015-04-20,University of Saskatchewan; Laurentian University; Laurentian University,Jacques K. Desmarais; Richard S. Smith,Electrical and Electromagnetic Methods,Canada; Canada; Canada,4,electromagnetics; modeling; algorithm; interpretation; imaging,2,2015-06-19,2014-11-10,Combining spatial components and Hilbert transforms to interpret ground-time-domain electromagnetic data,80
18,2015-04-13,Laurentian University,Michal Kolaj; Richard S. Smith,Electrical and Electromagnetic Methods,Canada,4,Electromagnetics; Mining,2,2015-06-22,2014-10-01,A multiple transmitter and receiver electromagnetic system for improved target detection,80
19,2015-01-30,University of Calgary,Roohollah Askari; S. Hossein Hejazi,Engineering and Environmental Geophysics,Canada,4,surface wave; dispersion curve; multi-mode; group velocity; phase velocity; generalized S-transform; slant stack,7,2015-05-29,2014-07-08,Estimation of surface-wave group velocity using slant stack in the generalized S-transform domain,80
20,2015-02-20,Politecnico di Torino; University of Oslo; NORSAR; Norwegian Geotechnical Institute; University of Oslo; NORSAR,Flora Garofalo; Guillaume Sauvin; Laura Valentina Socco; Isabelle Lecomte,Engineering and Environmental Geophysics,Italy; Norway; Norway; Norway,4,joint inversion; surface wave; P-wave refraction; resistivity; quick clay,7,2015-05-29,2014-07-10,Joint inversion of seismic and electric data applied to 2D media,80
21,2015-01-30,National Technical University of Athens; Harokopion University of Athens; Paris-Sorbonne University Abu Dhabi,George Apostolopoulos; Despina Minos-Minopoulos; Kosmas Pavlopoulos,Engineering and Environmental Geophysics,Greece; Greece; United Arab Emirates,4,case history; electromagnetics; resistivity; archaeology; engineering,0,2015-06-11,2014-03-03,"Geophysical investigation for the detection of liquefaction phenomena in an archaeological site, Lechaion, Greece",80
22,2015-03-03,Universidade Federal do Pará; Universidade Federal do Pará; National Institute for Petroleum Geophysics (INCT-GP); Universidade Federal do Pará; Secretaria de Educação do Estado do Pará; Formerly Universidade Federal do Pará,Darcicléa F. Santos; João B. C. Silva; Cristiano M. Martins; Raphael Di Carlo S. dos Santos; Laisse C. Ramos; Ana Carolina M. de Araújo,Gravity Exploration Methods,Brazil; Brazil; Brazil; Brazil; Brazil,4,gravity; faults; inversion; interpretation,3,2015-05-05,2014-11-04,Efficient gravity inversion of discontinuous basement relief,80
23,2015-03-16,"Fugro Geospatial, Inc.; National Oceanic and Atmospheric Administration (NOAA) National Geodetic Survey; University of New Brunswick",Detang Zhong; Theresa Marie Damiani; Sandra Ann Martinka Preaux; Robert William Kingdon,Gravity Exploration Methods,USA; USA; Canada,4,airborne survey; acquisition; gravimeter; gravity; processing,0,2015-06-08,2014-11-07,Comparison of airborne gravity processing results by GravPRO and Newton software packages,80
24,2015-03-17,Center for Gravity,Jiajia Sun; Yaoguo Li,Interdisciplinary Studies,USA,4,inversion; rock physics; statistics; algorithm; artificial intelligence,22,2015-06-22,2014-01-28,Multidomain petrophysically constrained inversion and geology differentiation using guided fuzzy c-means clustering,80
25,2015-02-15,Curtin University; CSIRO,Baichun Sun; Andrej Bóna; Binzhong Zhou; Matt van de Werken,Mining Geophysics,Australia; Australia,4,radiation; sources; monitoring; passive seismic,0,2015-05-26,2014-07-28,A comparison of radiated energy from diamond-impregnated coring and reverse-circulation percussion drilling methods in hard-rock environments,80
26,2015-04-06,Marathon Oil Company,Vladimir Grechka,Passive Seismic Methods,USA,4,microseismic; anisotropy,5,2015-05-26,2014-10-02,On the feasibility of inversion of single-well microseismic data for full moment tensor,80
27,2015-04-13,Université Joseph Fourier; Kantonales Laboratorium; Swiss Seismological Service; Colorado School of Mines,Gregor Hillers; Stephan Husen; Anne Obermann; Thomas Planès; Eric Larose; Michel Campillo,Passive Seismic Methods,France; Switzerland; Switzerland; USA,4,engineering; environmental; geothermal; noise; reservoir characterization,9,2015-06-25,2014-10-01,Noise-based monitoring and imaging of aseismic transient deformation induced by the 2006 Basel reservoir stimulation,80
28,2015-02-20,Colorado School of Mines; Whiting Petroleum Corporation; Colorado School of Mines,Patricia E. Rodrigues; Michael L. Batzle,Poroelasticity,USA; USA; USA,4,rock physics; shear wave (S-wave); shear modulus; amplitude,1,2015-05-26,2014-08-01,Strain amplitude dependence of shear modulus in heavy oils: Rheometer versus tension/compression technique,80
29,2015-03-09,Stanford University,Ammar El Husseiny; Tiziana Vanorio,Poroelasticity,USA,4,acoustic; carbonate; rock physics,5,2015-05-26,2014-12-18,The effect of micrite content on the acoustic velocity of carbonate rocks,80
30,2015-04-16,Massachusetts Institute of Technology; Schlumberger-Doll Research; Massachusetts Institute of Technology; Memorial University of Newfoundland,Oleg V. Poliannikov; Michael Prange; Hugues Djikpesse; Alison E. Malcolm; Michael Fehler,Reservoir Geophysics,USA; USA; USA; Canada,4,fractures; microseismic; permeability; statistics,4,2015-06-22,2014-08-11,Bayesian inversion of pressure diffusivity from microseismicity,80
31,2015-02-05,Texas Tech University; University of Houston,Anne-Cécile Lesage; Jie Yao; Fazle Hussain; Donald J. Kouri,Seismic Inversion,USA; USA,4,acoustic; algorithm; seafloor,9,2015-05-26,2014-07-31,Low-frequency reflection-data augmentation by an inpainting method: 1D acoustic media,80
32,2015-03-09,China University of Petroleum,Zhiming Ren; Yang Liu,Seismic Inversion,China,4,elastic full waveform inversion; staggered-grid; time-space domain finite-difference; the second generation wavelet; efficient boundary storage; checkpointing.,4,2015-05-26,2014-11-06,Elastic full-waveform inversion using the second-generation wavelet and an adaptive-operator-length scheme,80
33,2015-02-20,Deep Exploration Technology Cooperative Research Centre; Curtin University,Eric M. Takam Takougang; Brett Harris; Anton Kepic; Cuong V. A. Le,Seismic Inversion,Australia; Australia,4,resistivity; reflectivity; inversion; magnetotelluric; seismic impedance,4,2015-05-26,2014-05-28,Cooperative joint inversion of 3D seismic and magnetotelluric data: With application in a mineral province,80
34,2015-03-23,Tongji University,Benxin Chi; Liangguo Dong; Yuzhu Liu,Seismic Inversion,China,4,correlation; decomposition; reflection; full-waveform inversion,14,2015-06-10,2014-07-29,Correlation-based reflection full-waveform inversion,80
35,2015-04-13,Federal University of Bahia (UFBA); Compagnie Générale de Géophysique (CGG); UFBA,Adriano W. G. dos Santos; Reynam C. Pestana,Seismic Inversion,Brazil; USA; Brazil,4,full-waveform inversion; rapid expansion method; step length,2,2015-06-22,2014-07-24,Time-domain multiscale full-waveform inversion using the rapid expansion method and efficient step-length estimation,80
36,2015-02-04,King Abdullah University of Science and Technology; EXPEC ARC,Sanzong Zhang; Yi Luo; Gerard Schuster,Seismic Migration,Saudi Arabia; Saudi Arabia,4,tomography; traveltime; wave equation; crosscorrelation; Mexico,5,2015-05-26,2014-05-12,Shot- and angle-domain wave-equation traveltime inversion of reflection data: Synthetic and field data examples,80
37,2015-03-16,King Abdullah University of Science and Technology (KAUST); American University of Beirut,Ali Aldawood; Ibrahim Hoteit; Mohammad Zuberi; George Turkiyyah; Tariq AlKhalifah,Seismic Migration,Saudi Arabia; Lebanon,4,multiples; imaging; least squares; migration; scattering,6,2015-05-26,2014-09-16,The possibilities of least-squares migration of internally scattered seismic energy,80
38,2015-03-16,Tsinghua University,Lanlan Feng; Dinghui Yang; Wei Xie,Seismic Migration,China,4,2D; acoustic; anisotropy; RTM,1,2015-05-29,2014-05-24,An efficient symplectic reverse time migration method using a local nearly analytic discrete operator in acoustic transversely isotropic media with a vertical symmetry axis,80
39,2015-03-16,MIT Earth Resources Laboratory; Shell International E&amp;P Inc.; MIT Earth Resources Laboratory; Shell International E&amp;P Inc.,S. Ahmad Zamanian; William L. Rodi; Jonathan A. Kane; Michael C. Fehler,Seismic Migration,USA; USA; USA; USA,4,imaging; inversion; statistics; least squares; algorithm,0,2015-06-10,2014-08-07,Iterative estimation of reflectivity and image texture: Least-squares migration with an empirical Bayes approach,80
40,2015-04-06,Colorado School of Mines,Yuting Duan; Paul Sava,Seismic Migration,USA,4,converted wave; RTM; elastic,24,2015-06-18,2014-09-25,Scalar imaging condition for elastic reverse time migration,80
41,2015-04-20,The University of Edinburgh; Schlumberger Gould Research; Statoil,Matteo Ravasi; Ivan Vasconcelos; Andrew Curtis; Alexander Kritski,Seismic Migration,UK; UK; Norway,4,boundary conditions; reciprocity; migration; multicomponent; ocean-bottom cable (OBC),5,2015-06-23,2014-11-24,Vector-acoustic reverse time migration of Volve ocean-bottom cable data set without up/down decomposed wavefields,80
42,2015-04-20,DEP/FEM/Unicamp; National Institute of Petroleum Geophysics (INCT-GP); DMA/IMECC/Unicamp; National Institute of Petroleum Geophysics (INCT-GP),Henrique B. Santos; Tiago A. Coimbra; Jörg Schleicher; Amélia Novais,Seismic Migration,Brazil; Brazil,4,prestack; velocity analysis; wave propagation; ray tracing,2,2015-06-22,2014-05-02,Prestack time-migration velocity analysis using remigration trajectories,80
43,2015-03-03,The Chinese University of Hong Kong; Michigan State University,Eric T. Chung; Chi Yeung Lam; Jianliang Qian,Seismic Modeling and Wave Propagation,The People’s Republic of China; USA,4,finite element; surface wave; wave propagation; finite difference,5,2015-05-29,2014-08-29,A staggered discontinuous Galerkin method for the simulation of seismic waves with surface topography,80
44,2015-03-29,University of Colorado–Boulder; Shell International Exploration and Production,Bradley Martin; Bengt Fornberg; Amik St-Cyr,Seismic Modeling and Wave Propagation,USA; Netherlands,4,2D; wave equation; finite difference,13,2015-06-05,2014-10-15,Seismic modeling with radial-basis-function-generated finite differences,80
45,2015-03-23,The University of Texas at Dallas; Repsol Services Company,Wenlong Wang; George A. McMechan; Qunshan Zhang,Seismic Modeling and Wave Propagation,USA; USA,4,deconvolution; inversion; signal processing; reflectivity; sparse,18,2015-06-10,2014-11-30,Comparison of two algorithms for isotropic elastic P and S vector decomposition,80
46,2015-03-03,Université de Nantes,Philippe Cance; Yann Capdeville,Seismic Modeling and Wave Propagation,France,4,acoustic; compressional wave (P-wave); anisotropy; 2D; modeling,4,2015-06-10,2014-08-21,Validity of the acoustic approximation for elastic waves in heterogeneous media,80
47,2015-04-09,Chinese Academy of Sciences; Institute of Geology and Geophysics; University of Chinese Academy of Sciences; Chinese Academy of Sciences; Institute of Geology and Geophysics,Na Fan; Lian-Feng Zhao; Ying-Jie Gao; Zhen-Xing Yao,Seismic Modeling and Wave Propagation,China,4,finite difference; modeling; wave propagation; algorithm,2,2015-06-10,2015-01-01,A discontinuous collocated-grid implementation for high-order finite-difference modeling,80
48,2015-03-03,Center for Subsurface Imaging and Fluid Modeling (CSIM),Sanzong Zhang; Yi Luo; Gerard Schuster,Seismic Velocity/Statics,Saudi Arabia; Saudi Arabia,4,tomography; traveltime; wave equation; inversion; crosscorrelation,9,2015-05-26,2014-04-16,Shot- and angle-domain wave-equation traveltime inversion of reflection data: Theory,80
49,2015-03-10,University of Alberta,Jinkun Cheng; Mauricio D. Sacchi,Signal Processing,Canada,4,acquisition; inversion; coherence; signal processing; reconstruction,16,2015-05-29,2014-08-15,Separation and reconstruction of simultaneous source data via iterative rank reduction,80
50,2015-03-23,Jilin University; North University of China; Jilin University,Tie Zhong; Yue Li; Ning Wu; Pengfei Nie; Baojun Yang,Signal Processing,China; China; China,4,signal processing; random; noise; statistics,1,2015-06-08,2014-04-01,A study on the stationarity and Gaussianity of the background noise in land-seismic prospecting,80
51,2015-04-01,Massachusetts Institute of Technology; Tufts University; Tufts University,Gregory Ely; Shuchin Aeron; Ning Hao; Misha E. Kilmer,Signal Processing,USA; USA; USA,4,interpolation; prestack; random; sampling; signal processing,4,2015-06-08,2014-10-01,5D seismic data completion and denoising using a novel class of tensor decompositions,80
